URL,Version,Status,OIDs,Name,Title,Descriptino,Uses,Used,Sources
http://example.org/ValueSet/VSBarthelBathing,0.1.0,draft,,VSBarthelBathing,洗澡-選項,"","StructureDefinition/BarthelQuestionnaireResponse,ValueSet/VSBarthelTotal","LOINC"
http://example.org/ValueSet/VSBarthelBladder,0.1.0,draft,,VSBarthelBladder,小便控制-選項,"","StructureDefinition/BarthelQuestionnaireResponse,ValueSet/VSBarthelTotal","LOINC"
http://example.org/ValueSet/VSBarthelBowels,0.1.0,draft,,VSBarthelBowels,大便控制-選項,"","StructureDefinition/BarthelQuestionnaireResponse,ValueSet/VSBarthelTotal","LOINC"
http://example.org/ValueSet/VSBarthelDressing,0.1.0,draft,,VSBarthelDressing,穿脫衣服-選項,"","StructureDefinition/BarthelQuestionnaireResponse,ValueSet/VSBarthelTotal","LOINC"
http://example.org/ValueSet/VSBarthelFeeding,0.1.0,draft,,VSBarthelFeeding,進食-選項,"","StructureDefinition/BarthelQuestionnaireResponse,ValueSet/VSBarthelTotal","LOINC"
http://example.org/ValueSet/VSBarthelGrooming,0.1.0,draft,,VSBarthelGrooming,個人衛生-選項,"","StructureDefinition/BarthelQuestionnaireResponse,ValueSet/VSBarthelTotal","LOINC"
http://example.org/ValueSet/VSBarthelMobility,0.1.0,draft,,VSBarthelMobility,平地行走-選項,"","StructureDefinition/BarthelQuestionnaireResponse,ValueSet/VSBarthelTotal","LOINC"
http://example.org/ValueSet/VSBarthelStairs,0.1.0,draft,,VSBarthelStairs,上下樓梯-選項,"","StructureDefinition/BarthelQuestionnaireResponse,ValueSet/VSBarthelTotal","LOINC"
http://example.org/ValueSet/VSBarthelToiletUse,0.1.0,draft,,VSBarthelToiletUse,上廁所-選項,"","StructureDefinition/BarthelQuestionnaireResponse,ValueSet/VSBarthelTotal","LOINC"
http://example.org/ValueSet/VSBarthelTotal,0.1.0,draft,,VSBarthelTotal,Barthel Index 總值集,"整合 Barthel Index 各題之所有選項值集",,
http://example.org/ValueSet/VSBarthelTransfer,0.1.0,draft,,VSBarthelTransfer,移位-選項,"","StructureDefinition/BarthelQuestionnaireResponse,ValueSet/VSBarthelTotal","LOINC"
http://example.org/ValueSet/VSBodyStructure,0.1.0,draft,,VSBodyStructure,身體部位與結構對應之Snomed CT 代碼,"收錄復健可能會使用到的身體部位代碼",,"SCT"
http://example.org/ValueSet/assessment-side-valueset,0.1.0,draft,,AssessmentSideValueSet,評估側別選項,"受試者評估側別選項","StructureDefinition/ARATQuestionnaireResponse,StructureDefinition/FMAUEMotionQuestionnaireResponse,StructureDefinition/WMFTQuestionnaireResponse,StructureDefinition/FMAUESensoryQuestionnaireResponse","SCT"
http://example.org/ValueSet/mas-score,0.1.0,draft,,VSMAScore,MAS 分數 (0,1,1+,2,3,4),"","Questionnaire/MASQuestionnaireInstance,StructureDefinition/MASQuestionnaireResponse","Other"
http://hl7.org/fhir/ValueSet/administration-method-codes,4.0.1,draft,"2.16.840.1.113883.4.642.3.97",SNOMEDCTAdministrationMethodCodes,SNOMED CT Administration Method Codes,"This value set includes some method codes from SNOMED CT - provided as an exemplar","StructureDefinition/MyMedicationAdministration","SCT"
http://hl7.org/fhir/ValueSet/administrative-gender,4.0.1,active,"2.16.840.1.113883.4.642.3.1",AdministrativeGender,AdministrativeGender,"The gender of a person used for administrative purposes.","StructureDefinition/Patient,StructureDefinition/Practitioner","hl7.fhir.r4.core"
http://hl7.org/fhir/ValueSet/approach-site-codes,4.0.1,draft,"2.16.840.1.113883.4.642.3.346",SNOMEDCTAnatomicalStructureForAdministrationSiteCodes,SNOMED CT Anatomical Structure for Administration Site Codes,"This value set includes Anatomical Structure codes from SNOMED CT - provided as an exemplar.","StructureDefinition/MyMedicationAdministration","SCT"
http://hl7.org/fhir/ValueSet/body-site,4.0.1,draft,"2.16.840.1.113883.4.642.3.141",SNOMEDCTBodyStructures,SNOMED CT Body Structures,"This value set includes all codes from [SNOMED CT](http://snomed.info/sct) where concept is-a 442083009 (Anatomical or acquired body site (body structure)).","StructureDefinition/Procedure,StructureDefinition/ObservationScreeningAssessment,StructureDefinition/PACCondition","SCT"
http://hl7.org/fhir/ValueSet/bundle-type,4.0.1,active,"2.16.840.1.113883.4.642.3.620",BundleType,BundleType,"Indicates the purpose of a bundle - how it is intended to be used.","StructureDefinition/ReponseBundle","hl7.fhir.r4.core"
http://hl7.org/fhir/ValueSet/c80-practice-codes,4.0.1,active,"2.16.840.1.113883.3.88.12.80.72",PracticeSettingCodeValueSet,Practice Setting Code Value Set,"This is the code representing the clinical specialty of the clinician or provider who interacted with, treated, or provided a service to/for the patient. The value set used for clinical specialty has been limited by HITSP to the value set reproduced from HITSP C80 Table 2-149 Clinical Specialty Value Set Definition.","StructureDefinition/PractitionerRole","SCT"
http://hl7.org/fhir/ValueSet/care-plan-activity-kind,4.0.1,draft,"2.16.840.1.113883.4.642.3.145",CarePlanActivityKind,Care Plan Activity Kind,"Resource types defined as part of FHIR that can be represented as in-line definitions of a care plan activity.","StructureDefinition/CarePlan,StructureDefinition/PACCarePlan","hl7.fhir.r4.core"
http://hl7.org/fhir/ValueSet/care-plan-activity-outcome,4.0.1,draft,"2.16.840.1.113883.4.642.3.149",CarePlanActivityOutcome,Care Plan Activity Outcome,"Example codes indicating the outcome of a care plan activity. Note that these are in no way complete and might not even be appropriate for some uses.","StructureDefinition/CarePlan,StructureDefinition/PACCarePlan","SCT"
http://hl7.org/fhir/ValueSet/care-plan-activity-status,4.0.1,draft,"2.16.840.1.113883.4.642.3.146",CarePlanActivityStatus,CarePlanActivityStatus,"Codes that reflect the current state of a care plan activity within its overall life cycle.","StructureDefinition/CarePlan,StructureDefinition/PACCarePlan","hl7.fhir.r4.core"
http://hl7.org/fhir/ValueSet/care-plan-category,4.0.1,draft,"2.16.840.1.113883.4.642.3.148",CarePlanCategory,Care Plan Category,"Example codes indicating the category a care plan falls within.  Note that these are in no way complete and might not even be appropriate for some uses.","StructureDefinition/CarePlan,StructureDefinition/PACCarePlan","SCT"
http://hl7.org/fhir/ValueSet/care-plan-intent,4.0.1,draft,"2.16.840.1.113883.4.642.3.150",CarePlanIntent,Care Plan Intent,"Codes indicating the degree of authority/intentionality associated with a care plan.","StructureDefinition/CarePlan,StructureDefinition/PACCarePlan","hl7.fhir.r4.core"
http://hl7.org/fhir/ValueSet/clinical-findings,4.0.1,draft,"2.16.840.1.113883.4.642.3.232",SNOMEDCTClinicalFindings,SNOMED CT Clinical Findings,"This value set includes all the ""Clinical finding"" [SNOMED CT](http://snomed.info/sct) codes - concepts where concept is-a 404684003 (Clinical finding (finding)).","StructureDefinition/CarePlan,StructureDefinition/Goal,StructureDefinition/PACCarePlan","SCT"
http://hl7.org/fhir/ValueSet/condition-category,4.0.1,draft,"2.16.840.1.113883.4.642.3.162",ConditionCategoryCodes,Condition Category Codes,"Preferred value set for Condition Categories.","StructureDefinition/PACCondition","THO"
http://hl7.org/fhir/ValueSet/condition-clinical,4.0.1,draft,"2.16.840.1.113883.4.642.3.164",ConditionClinicalStatusCodes,Condition Clinical Status Codes,"Preferred value set for Condition Clinical Status.","StructureDefinition/PACCondition","THO"
http://hl7.org/fhir/ValueSet/condition-code,4.0.1,draft,"2.16.840.1.113883.4.642.3.161",Condition/Problem/DiagnosisCodes,Condition/Problem/Diagnosis Codes,"Example value set for Condition/Problem/Diagnosis codes.","StructureDefinition/Procedure,StructureDefinition/PACCondition","SCT"
http://hl7.org/fhir/ValueSet/condition-severity,4.0.1,draft,"2.16.840.1.113883.4.642.3.168",Condition/DiagnosisSeverity,Condition/Diagnosis Severity,"Preferred value set for Condition/Diagnosis severity grading.","StructureDefinition/PACCondition","SCT"
http://hl7.org/fhir/ValueSet/condition-stage,4.0.1,draft,"2.16.840.1.113883.4.642.3.170",ConditionStage,Condition Stage,"Example value set for stages of cancer and other conditions.","StructureDefinition/PACCondition","SCT"
http://hl7.org/fhir/ValueSet/condition-stage-type,4.0.1,draft,"2.16.840.1.113883.4.642.3.171",ConditionStageType,Condition Stage Type,"Example value set for the type of stages of cancer and other conditions","StructureDefinition/PACCondition","SCT"
http://hl7.org/fhir/ValueSet/condition-ver-status,4.0.1,draft,"2.16.840.1.113883.4.642.3.166",ConditionVerificationStatus,ConditionVerificationStatus,"The verification status to support or decline the clinical status of the condition or diagnosis.","StructureDefinition/PACCondition","THO"
http://hl7.org/fhir/ValueSet/contact-point-system,4.0.1,active,"2.16.840.1.113883.4.642.3.71",ContactPointSystem,ContactPointSystem,"Telecommunications form for contact point.","StructureDefinition/Patient,StructureDefinition/PractitionerRole,StructureDefinition/Practitioner,StructureDefinition/Organization","hl7.fhir.r4.core"
http://hl7.org/fhir/ValueSet/contact-point-use,4.0.1,active,"2.16.840.1.113883.4.642.3.73",ContactPointUse,ContactPointUse,"Use of contact point.","StructureDefinition/Patient,StructureDefinition/PractitionerRole,StructureDefinition/Practitioner,StructureDefinition/Organization","hl7.fhir.r4.core"
http://hl7.org/fhir/ValueSet/contactentity-type,4.0.1,draft,"2.16.840.1.113883.4.642.3.416",ContactEntityType,Contact entity type,"This example value set defines a set of codes that can be used to indicate the purpose for which you would contact a contact party.","StructureDefinition/Organization","THO"
http://hl7.org/fhir/ValueSet/data-absent-reason,4.0.1,active,"2.16.840.1.113883.4.642.3.5",DataAbsentReason,DataAbsentReason,"Used to specify why the normally expected content of the data element is missing.","StructureDefinition/ObservationScreeningAssessment","THO"
http://hl7.org/fhir/ValueSet/days-of-week,4.0.1,active,"2.16.840.1.113883.4.642.3.512",DaysOfWeek,DaysOfWeek,"The days of the week.","StructureDefinition/PractitionerRole","hl7.fhir.r4.core"
http://hl7.org/fhir/ValueSet/device-action,4.0.1,draft,"2.16.840.1.113883.4.642.3.425",ProcedureDeviceActionCodes,Procedure Device Action Codes,"Example codes indicating the change that happened to the device during the procedure.  Note that these are in no way complete and might not even be appropriate for some uses.","StructureDefinition/Procedure","SCT"
http://hl7.org/fhir/ValueSet/device-kind,4.0.1,draft,"2.16.840.1.113883.4.642.3.208",FHIRDeviceTypes,FHIR Device Types,"Codes used to identify medical devices. Includes concepts from SNOMED CT (http://www.snomed.org/) where concept is-a 49062001 (Device)  and is provided as a suggestive example.","StructureDefinition/Procedure","SCT"
http://hl7.org/fhir/ValueSet/diagnosis-role,4.0.1,draft,"2.16.840.1.113883.4.642.3.49",DiagnosisRole,DiagnosisRole,"This value set defines a set of codes that can be used to express the role of a diagnosis on the Encounter or EpisodeOfCare record.","StructureDefinition/Encounter","THO"
http://hl7.org/fhir/ValueSet/encounter-admit-source,4.0.1,draft,"2.16.840.1.113883.4.642.3.257",AdmitSource,Admit source,"This value set defines a set of codes that can be used to indicate from where the patient came in.","StructureDefinition/Encounter","THO"
http://hl7.org/fhir/ValueSet/encounter-diet,4.0.1,draft,"2.16.840.1.113883.4.642.3.255",Diet,Diet,"This value set defines a set of codes that can be used to indicate dietary preferences or restrictions a patient may have.","StructureDefinition/Encounter","THO"
http://hl7.org/fhir/ValueSet/encounter-discharge-disposition,4.0.1,draft,"2.16.840.1.113883.4.642.3.259",DischargeDisposition,Discharge disposition,"This value set defines a set of codes that can be used to where the patient left the hospital.","StructureDefinition/Encounter","THO"
http://hl7.org/fhir/ValueSet/encounter-location-status,4.0.1,draft,"2.16.840.1.113883.4.642.3.262",EncounterLocationStatus,EncounterLocationStatus,"The status of the location.","StructureDefinition/Encounter","hl7.fhir.r4.core"
http://hl7.org/fhir/ValueSet/encounter-participant-type,4.0.1,draft,"2.16.840.1.113883.4.642.3.250",ParticipantType,Participant type,"This value set defines a set of codes that can be used to indicate how an individual participates in an encounter.","StructureDefinition/Encounter","THO (V3),THO"
http://hl7.org/fhir/ValueSet/encounter-reason,4.0.1,draft,"2.16.840.1.113883.4.642.3.261",EncounterReasonCodes,Encounter Reason Codes,"This examples value set defines the set of codes that can be used to indicate reasons for an encounter.","StructureDefinition/Encounter","SCT"
http://hl7.org/fhir/ValueSet/encounter-special-arrangements,4.0.1,draft,"2.16.840.1.113883.4.642.3.253",SpecialArrangements,Special arrangements,"This value set defines a set of codes that can be used to indicate the kinds of special arrangements in place for a patients visit.","StructureDefinition/Encounter","THO"
http://hl7.org/fhir/ValueSet/encounter-special-courtesy,4.0.1,draft,"2.16.840.1.113883.4.642.3.252",SpecialCourtesy,Special courtesy,"This value set defines a set of codes that can be used to indicate special courtesies provided to the patient.","StructureDefinition/Encounter","THO (V3)"
http://hl7.org/fhir/ValueSet/encounter-status,4.0.1,draft,"2.16.840.1.113883.4.642.3.246",EncounterStatus,EncounterStatus,"Current state of the encounter.","StructureDefinition/Encounter","hl7.fhir.r4.core"
http://hl7.org/fhir/ValueSet/encounter-type,4.0.1,draft,"2.16.840.1.113883.4.642.3.248",EncounterType,Encounter type,"This example value set defines a set of codes that can be used to indicate the type of encounter: a specific code indicating type of service provided.","StructureDefinition/Encounter","THO"
http://hl7.org/fhir/ValueSet/event-status,4.0.1,draft,"2.16.840.1.113883.4.642.3.109",EventStatus,EventStatus,"Codes identifying the lifecycle stage of an event.","StructureDefinition/Procedure","hl7.fhir.r4.core"
http://hl7.org/fhir/ValueSet/goal-achievement,4.0.1,draft,"2.16.840.1.113883.4.642.3.1374",GoalAchievementStatus,Goal achievement status,"Describes the progression, or lack thereof, towards the goal against the target.","StructureDefinition/Goal","THO"
http://hl7.org/fhir/ValueSet/goal-category,4.0.1,draft,"2.16.840.1.113883.4.642.3.275",GoalCategory,Goal category,"Example codes for grouping goals to use for filtering or presentation.","StructureDefinition/Goal","THO"
http://hl7.org/fhir/ValueSet/goal-priority,4.0.1,draft,"2.16.840.1.113883.4.642.3.273",GoalPriority,Goal priority,"Indicates the level of importance associated with reaching or sustaining a goal.","StructureDefinition/Goal","THO"
http://hl7.org/fhir/ValueSet/goal-start-event,4.0.1,draft,"2.16.840.1.113883.4.642.3.279",GoalStartEvent,Goal start event,"Identifies types of events that might trigger the start of a goal.","StructureDefinition/Goal","SCT"
http://hl7.org/fhir/ValueSet/goal-status,4.0.1,draft,"2.16.840.1.113883.4.642.3.271",GoalLifecycleStatus,GoalLifecycleStatus,"Codes that reflect the current state of a goal and whether the goal is still being targeted.","StructureDefinition/Goal","hl7.fhir.r4.core"
http://hl7.org/fhir/ValueSet/http-verb,4.0.1,active,"2.16.840.1.113883.4.642.3.624",HTTPVerb,HTTPVerb,"HTTP verbs (in the HTTP command line). See [HTTP rfc](https://tools.ietf.org/html/rfc7231) for details.","StructureDefinition/ReponseBundle","hl7.fhir.r4.core"
http://hl7.org/fhir/ValueSet/identifier-type,4.0.1,active,"2.16.840.1.113883.4.642.3.45",Identifier Type Codes,IdentifierType,"A coded type for an identifier that can be used to determine which identifier to use for a specific purpose.","StructureDefinition/Encounter,StructureDefinition/Patient","THO (V2)"
http://hl7.org/fhir/ValueSet/identifier-use,4.0.1,active,"2.16.840.1.113883.4.642.3.57",IdentifierUse,IdentifierUse,"Identifies the purpose for this identifier, if known .","StructureDefinition/Encounter,StructureDefinition/Patient,StructureDefinition/Practitioner,StructureDefinition/Organization","hl7.fhir.r4.core"
http://hl7.org/fhir/ValueSet/item-type,4.0.1,draft,"2.16.840.1.113883.4.642.3.444",QuestionnaireItemType,QuestionnaireItemType,"Distinguishes groups from questions and display text and indicates data type for questions.","StructureDefinition/SPACQuestionnaire","hl7.fhir.r4.core"
http://hl7.org/fhir/ValueSet/jurisdiction,4.0.1,active,"2.16.840.1.113883.4.642.3.48",Jurisdiction ValueSet,Jurisdiction,"This value set defines a base set of codes for country, country subdivision and region    for indicating where a resource is intended to be used.             Note: The codes for countries and country subdivisions are taken from    [ISO 3166](https://www.iso.org/iso-3166-country-codes.html)    while the codes for ""supra-national"" regions are from    [UN Standard country or area codes for statistical use (M49)](http://unstats.un.org/unsd/methods/m49/m49.htm).","StructureDefinition/SPACQuestionnaire","hl7.terminology.r4,Other"
http://hl7.org/fhir/ValueSet/languages,4.0.1,draft,"2.16.840.1.113883.4.642.3.20",CommonLanguages,Common Languages,"This value set includes common codes from BCP-47 (http://tools.ietf.org/html/bcp47)","StructureDefinition/IADLQuestionnaireResponse,StructureDefinition/WMFTQuestionnaireResponse,StructureDefinition/Practitioner,StructureDefinition/PACCarePlan,StructureDefinition/FMAUESensoryQuestionnaireResponse,StructureDefinition/Organization,StructureDefinition/ARATQuestionnaireResponse,StructureDefinition/Patient,StructureDefinition/bbt-questionnaire-response,StructureDefinition/SPACQuestionnaireResponse,StructureDefinition/ObservationScreeningAssessment,StructureDefinition/SPACQuestionnaire,StructureDefinition/CarePlan,StructureDefinition/MyMedicationAdministration,StructureDefinition/FMAUEMotionQuestionnaireResponse,StructureDefinition/Goal,StructureDefinition/MASQuestionnaireResponse,StructureDefinition/MMSEQuestionnaireResponse,StructureDefinition/Procedure,StructureDefinition/Encounter,StructureDefinition/BarthelQuestionnaireResponse,StructureDefinition/PractitionerRole,StructureDefinition/ReponseBundle,StructureDefinition/MRCQuestionnaireResponse,StructureDefinition/PACCondition","hl7.terminology.r4"
http://hl7.org/fhir/ValueSet/link-type,4.0.1,active,"2.16.840.1.113883.4.642.3.423",LinkType,LinkType,"The type of link between this patient resource and another patient resource.","StructureDefinition/Patient","hl7.fhir.r4.core"
http://hl7.org/fhir/ValueSet/location-physical-type,4.0.1,draft,"2.16.840.1.113883.4.642.3.328",LocationType,Location type,"This example value set defines a set of codes that can be used to indicate the physical form of the Location.","StructureDefinition/Encounter","THO"
http://hl7.org/fhir/ValueSet/manifestation-or-symptom,4.0.1,draft,"2.16.840.1.113883.4.642.3.169",ManifestationAndSymptomCodes,Manifestation and Symptom Codes,"Example value set for Manifestation and Symptom codes.","StructureDefinition/PACCondition","SCT"
http://hl7.org/fhir/ValueSet/marital-status,4.0.1,active,"2.16.840.1.113883.4.642.3.29",Marital Status Codes,MaritalStatus,"This value set defines the set of codes that can be used to indicate the marital status of a person.","StructureDefinition/Patient","THO (V3)"
http://hl7.org/fhir/ValueSet/med-admin-perform-function,4.0.1,draft,"2.16.840.1.113883.4.642.3.349",MedicationAdministration Performer Function Codes,Medication administration  performer  function  codes,"MedicationAdministration Performer Function Codes","StructureDefinition/MyMedicationAdministration","THO"
http://hl7.org/fhir/ValueSet/medication-admin-category,4.0.1,draft,"2.16.840.1.113883.4.642.3.347",MedicationAdministration Category Codes,Medication administration  category  codes,"MedicationAdministration Category Codes","StructureDefinition/MyMedicationAdministration","THO"
http://hl7.org/fhir/ValueSet/medication-admin-status,4.0.1,draft,"2.16.840.1.113883.4.642.3.340",MedicationAdministration Status Codes,Medication administration  status  codes,"MedicationAdministration Status Codes","StructureDefinition/MyMedicationAdministration","THO"
http://hl7.org/fhir/ValueSet/medication-codes,4.0.1,draft,"2.16.840.1.113883.4.642.3.375",SNOMEDCTMedicationCodes,SNOMED CT Medication Codes,"This value set includes all drug or medicament substance codes and all pharmaceutical/biologic products from SNOMED CT - provided as an exemplar value set.","StructureDefinition/CarePlan,StructureDefinition/MyMedicationAdministration,StructureDefinition/PACCarePlan","SCT"
http://hl7.org/fhir/ValueSet/name-use,4.0.1,active,"2.16.840.1.113883.4.642.3.65",NameUse,NameUse,"The use of a human name.","StructureDefinition/Patient,StructureDefinition/Practitioner","hl7.fhir.r4.core"
http://hl7.org/fhir/ValueSet/observation-category,4.0.1,draft,"2.16.840.1.113883.4.642.3.403",ObservationCategoryCodes,Observation Category Codes,"Observation Category codes.","StructureDefinition/ObservationScreeningAssessment","THO"
http://hl7.org/fhir/ValueSet/observation-codes,4.0.1,draft,"2.16.840.1.113883.4.642.3.396",LOINCCodes,LOINC Codes,"This value set includes all LOINC codes","StructureDefinition/Procedure,StructureDefinition/ObservationScreeningAssessment,StructureDefinition/Goal","LOINC"
http://hl7.org/fhir/ValueSet/observation-interpretation,4.0.1,active,"2.16.840.1.113883.4.642.3.399",ObservationInterpretationCodes,Observation Interpretation Codes,"A categorical assessment, providing a rough qualitative interpretation of the observation value,    such as “normal”/ “abnormal”,”low” / “high”, “better” / “worse”, “susceptible” / “resistant”, “expected”/ “not expected”.    The value set is intended to be for ANY use where coded representation of an interpretation is needed.             Notes:          This is being communicated in v2.x in OBX-8 (Observation Interpretation), in v3 in ObservationInterpretation (CWE) in R1 (Representative Realm) and in FHIR in    Observation.interpretation. Historically these values come from the laboratory domain, and these codes are extensively    used. The value set binding is extensible, so codes outside the value set that are needed for interpretation concepts    (i.e. particular meanings) that are not included in the value set can be used, and these new codes may also be added to    the value set and published in a future version.","StructureDefinition/ObservationScreeningAssessment","THO (V3)"
http://hl7.org/fhir/ValueSet/observation-methods,4.0.1,draft,"2.16.840.1.113883.4.642.3.395",ObservationMethods,Observation Methods,"Observation Method codes from [SNOMED CT](http://snomed.info/sct) where concept is-a 272394005 (Technique (qualifier value)) or is-a 129264002 (Action (qualifier value)) or is-a 386053000 (Evaluation procedure(procedure))","StructureDefinition/ObservationScreeningAssessment","SCT"
http://hl7.org/fhir/ValueSet/observation-status,4.0.1,active,"2.16.840.1.113883.4.642.3.400",ObservationStatus,ObservationStatus,"Codes providing the status of an observation.","StructureDefinition/ObservationScreeningAssessment","hl7.fhir.r4.core"
http://hl7.org/fhir/ValueSet/organization-type,4.0.1,draft,"2.16.840.1.113883.4.642.3.414",OrganizationType,Organization type,"This example value set defines a set of codes that can be used to indicate a type of organization.","StructureDefinition/Organization","THO"
http://hl7.org/fhir/ValueSet/performer-role,4.0.1,draft,"2.16.840.1.113883.4.642.3.433",ProcedurePerformerRoleCodes,Procedure Performer Role Codes,"This example value set defines the set of codes that can be used to indicate a role of a procedure performer.","StructureDefinition/Procedure","SCT"
http://hl7.org/fhir/ValueSet/procedure-category,4.0.1,draft,"2.16.840.1.113883.4.642.3.430",ProcedureCategoryCodes(SNOMEDCT),Procedure Category Codes (SNOMED CT),"Procedure Category code: A selection of relevant SNOMED CT codes.","StructureDefinition/Procedure","SCT"
http://hl7.org/fhir/ValueSet/procedure-code,4.0.1,draft,"2.16.840.1.113883.4.642.3.427",ProcedureCodes(SNOMEDCT),Procedure Codes (SNOMED CT),"Procedure Code: All SNOMED CT procedure codes.","StructureDefinition/Procedure,StructureDefinition/CarePlan,StructureDefinition/PACCarePlan","SCT"
http://hl7.org/fhir/ValueSet/procedure-followup,4.0.1,draft,"2.16.840.1.113883.4.642.3.429",ProcedureFollowUpCodes(SNOMEDCT),Procedure Follow up Codes (SNOMED CT),"Procedure follow up codes: A selection of SNOMED CT codes relevant to procedure follow up.","StructureDefinition/Procedure","SCT"
http://hl7.org/fhir/ValueSet/procedure-not-performed-reason,4.0.1,active,"2.16.840.1.113883.4.642.3.431",ProcedureNotPerformedReason(SNOMED-CT),Procedure Not Performed Reason (SNOMED-CT),"Situation codes describing the reason that a procedure, which might otherwise be expected, was not performed, or a procedure that was started and was not completed. Consists of SNOMED CT codes, children of procedure contraindicated (183932001), procedure discontinued (416406003), procedure not done (416237000), procedure not indicated (428119001), procedure not offered (416064006), procedure not wanted (416432009), procedure refused (183944003), and procedure stopped (394908001).","StructureDefinition/Procedure","SCT"
http://hl7.org/fhir/ValueSet/procedure-outcome,4.0.1,draft,"2.16.840.1.113883.4.642.3.428",ProcedureOutcomeCodes(SNOMEDCT),Procedure Outcome Codes (SNOMED CT),"Procedure Outcome code: A selection of relevant SNOMED CT codes.","StructureDefinition/Procedure","SCT"
http://hl7.org/fhir/ValueSet/procedure-reason,4.0.1,draft,"2.16.840.1.113883.4.642.3.432",ProcedureReasonCodes,Procedure Reason Codes,"This example value set defines the set of codes that can be used to indicate a reason for a procedure.","StructureDefinition/Procedure","SCT"
