URL,Version,Status,OIDs,Name,Title,Descriptino,Uses,Used,Sources
http://hl7.org/fhir/ValueSet/publication-status,4.0.1,active,"2.16.840.1.113883.4.642.3.3",PublicationStatus,PublicationStatus,"The lifecycle status of an artifact.","StructureDefinition/SPACQuestionnaire","hl7.fhir.r4.core"
http://hl7.org/fhir/ValueSet/questionnaire-answers,4.0.1,draft,"2.16.840.1.113883.4.642.3.446",QuestionnaireAnswerCodes,Questionnaire Answer Codes,"Example list of codes for answers to questions. (Not complete or necessarily appropriate.)","StructureDefinition/BarthelQuestionnaireResponse,StructureDefinition/ARATQuestionnaireResponse,StructureDefinition/bbt-questionnaire-response,StructureDefinition/IADLQuestionnaireResponse,StructureDefinition/FMAUEMotionQuestionnaireResponse,StructureDefinition/SPACQuestionnaireResponse,StructureDefinition/WMFTQuestionnaireResponse,StructureDefinition/SPACQuestionnaire,StructureDefinition/MMSEQuestionnaireResponse,StructureDefinition/MRCQuestionnaireResponse,StructureDefinition/FMAUESensoryQuestionnaireResponse","SCT"
http://hl7.org/fhir/ValueSet/questionnaire-answers-status,4.0.1,draft,"required",QuestionnaireResponseStatus,QuestionnaireResponseStatus,"Lifecycle status of the questionnaire response.","StructureDefinition/BarthelQuestionnaireResponse,StructureDefinition/ARATQuestionnaireResponse,StructureDefinition/bbt-questionnaire-response,StructureDefinition/IADLQuestionnaireResponse,StructureDefinition/FMAUEMotionQuestionnaireResponse,StructureDefinition/SPACQuestionnaireResponse,StructureDefinition/MASQuestionnaireResponse,StructureDefinition/WMFTQuestionnaireResponse,StructureDefinition/MMSEQuestionnaireResponse,StructureDefinition/MRCQuestionnaireResponse,StructureDefinition/FMAUESensoryQuestionnaireResponse","hl7.fhir.r4.core"
http://hl7.org/fhir/ValueSet/questionnaire-enable-behavior,4.0.1,draft,"2.16.840.1.113883.4.642.3.1007",EnableWhenBehavior,EnableWhenBehavior,"Controls how multiple enableWhen values are interpreted -  whether all or any must be true.","StructureDefinition/SPACQuestionnaire","hl7.fhir.r4.core"
http://hl7.org/fhir/ValueSet/questionnaire-enable-operator,4.0.1,draft,"2.16.840.1.113883.4.642.3.1005",QuestionnaireItemOperator,QuestionnaireItemOperator,"The criteria by which a question is enabled.","StructureDefinition/SPACQuestionnaire","hl7.fhir.r4.core"
http://hl7.org/fhir/ValueSet/questionnaire-questions,4.0.1,draft,"2.16.840.1.113883.4.642.3.443",QuestionnaireQuestionCodes,Questionnaire Question Codes,"Example list of codes for questions and groups of questions. (Not necessarily complete or appropriate.)","StructureDefinition/SPACQuestionnaire","LOINC"
http://hl7.org/fhir/ValueSet/reason-medication-given-codes,4.0.1,draft,"2.16.840.1.113883.4.642.3.344",ReasonMedicationGivenCodes,Reason Medication Given Codes,"This value set is provided as an example. The value set to instantiate this attribute should be drawn from a robust terminology code system that consists of or contains concepts to support the medication process.","StructureDefinition/MyMedicationAdministration","THO"
http://hl7.org/fhir/ValueSet/reason-medication-not-given-codes,4.0.1,draft,"2.16.840.1.113883.4.642.3.342",SNOMEDCTReasonMedicationNotGivenCodes,SNOMED CT Reason Medication Not Given Codes,"This value set includes all medication refused, medication not administered, and non-administration of necessary drug or medicine codes from SNOMED CT - provided as an exemplar value set.","StructureDefinition/MyMedicationAdministration","SCT"
http://hl7.org/fhir/ValueSet/referencerange-appliesto,4.0.1,draft,"2.16.840.1.113883.4.642.3.407",ObservationReferenceRangeAppliesToCodes,Observation Reference Range Applies To Codes,"This value set defines a set of codes that can be used to indicate the particular target population the reference range applies to.","StructureDefinition/ObservationScreeningAssessment","SCT"
http://hl7.org/fhir/ValueSet/referencerange-meaning,4.0.1,draft,"2.16.840.1.113883.4.642.3.397",ObservationReferenceRangeMeaningCodes,Observation Reference Range Meaning Codes,"This value set defines a set of codes that can be used to indicate the meaning/use of a reference range for a particular target population.","StructureDefinition/ObservationScreeningAssessment","THO"
http://hl7.org/fhir/ValueSet/relatedperson-relationshiptype,4.0.1,draft,"2.16.840.1.113883.4.642.3.449",PatientRelationshipType,Patient relationship type,"A set of codes that can be used to indicate the relationship between a Patient and a Related Person.","StructureDefinition/Patient","THO (V3),THO (V2)"
http://hl7.org/fhir/ValueSet/request-status,4.0.1,draft,"2.16.840.1.113883.4.642.3.111",RequestStatus,RequestStatus,"Codes identifying the lifecycle stage of a request.","StructureDefinition/CarePlan,StructureDefinition/PACCarePlan","hl7.fhir.r4.core"
http://hl7.org/fhir/ValueSet/resource-types,4.0.1,active,"2.16.840.1.113883.4.642.3.27",ResourceType,ResourceType,"One of the resource types defined as part of this version of FHIR.","StructureDefinition/BarthelQuestionnaireResponse,StructureDefinition/ARATQuestionnaireResponse,StructureDefinition/IADLQuestionnaireResponse,StructureDefinition/FMAUEMotionQuestionnaireResponse,StructureDefinition/SPACQuestionnaireResponse,StructureDefinition/MASQuestionnaireResponse,StructureDefinition/WMFTQuestionnaireResponse,StructureDefinition/SPACQuestionnaire,StructureDefinition/MMSEQuestionnaireResponse,StructureDefinition/MRCQuestionnaireResponse,StructureDefinition/FMAUESensoryQuestionnaireResponse","hl7.fhir.r4.core"
http://hl7.org/fhir/ValueSet/route-codes,4.0.1,draft,"2.16.840.1.113883.4.642.3.98",SNOMEDCTRouteCodes,SNOMED CT Route Codes,"This value set includes all Route codes from SNOMED CT - provided as an exemplar.","StructureDefinition/MyMedicationAdministration","SCT"
http://hl7.org/fhir/ValueSet/search-entry-mode,4.0.1,active,"2.16.840.1.113883.4.642.3.622",SearchEntryMode,SearchEntryMode,"Why an entry is in the result set - whether it's included as a match or because of an _include requirement, or to convey information or warning information about the search process.","StructureDefinition/ReponseBundle","hl7.fhir.r4.core"
http://hl7.org/fhir/ValueSet/service-type,4.0.1,draft,"2.16.840.1.113883.4.642.3.518",ServiceType,Service type,"This value set defines an example set of codes of service-types.","StructureDefinition/Encounter","THO"
http://hl7.org/fhir/uv/ips/ValueSet/absent-or-unknown-problems-uv-ips,1.1.0,active,,AbsentOrUnknownProblemsUvIps,Absent or Unknown Problems - IPS,"Absent or Unknown Problems","StructureDefinition/PACCondition","hl7.fhir.uv.ips"
http://terminology.hl7.org/ValueSet/v2-0092,2.0.0,active,"2.16.840.1.113883.21.40",Hl7VSReAdmissionIndicator,hl7VS-re-admissionIndicator,"Value Set of codes which are used to specify that a patient is being re-admitted to a healthcare facility from which they were discharged, and indicates the circumstances around such re-admission.","StructureDefinition/Encounter","THO (V2)"
http://terminology.hl7.org/ValueSet/v3-ActEncounterCode,3.0.0,active,"2.16.840.1.113883.1.11.13955",ActEncounterCode,ActEncounterCode,"Domain provides codes that qualify the ActEncounterClass (ENC)","StructureDefinition/Encounter","THO (V3)"
http://terminology.hl7.org/ValueSet/v3-ActPriority,3.0.0,active,"2.16.840.1.113883.1.11.16866",ActPriority,ActPriority,"A code or set of codes (e.g., for routine, emergency,) specifying the urgency under which the Act happened, can happen, is happening, is intended to happen, or is requested/demanded to happen.    *Discussion:* This attribute is used in orders to indicate the ordered priority, and in event documentation it indicates the actual priority used to perform the act. In definition mood it indicates the available priorities.","StructureDefinition/Encounter","THO (V3)"
https://twcore.mohw.gov.tw/ig/twcore/ValueSet/condition-code-sct-tw,2022-07-31,active,,TWConditionCodeSCT,SNOMED CT診斷代碼值集,"SNOMED CT診斷代碼值集。","StructureDefinition/PACCondition","SCT"
https://twcore.mohw.gov.tw/ig/twcore/ValueSet/health-professional-sct-tw,0.3.0,active,,TWHealthProfessionalSCT,SNOMED CT + 臺灣醫事司醫事人員類別值集,"SNOMED CT + 臺灣醫事司醫事人員類別值集。  此值集優先採用國際標準碼，國際標準碼未能表述之概念則以普遍被使用的臺灣醫事司醫事人員類別標準碼表述，請實作者留意。","StructureDefinition/PractitionerRole,StructureDefinition/Practitioner","tw.gov.mohw.twcore,SCT"
https://twcore.mohw.gov.tw/ig/twcore/ValueSet/icd-10-cm-2014-tw,2017-07-19,active,,TW2014ICD10CM,臺灣健保署2014年中文版ICD-10-CM值集,"臺灣健保署2014年中文版ICD-10-CM值集。 資料所屬單位：衛生福利部中央健康保險署。   此值集所涵蓋代碼量較大會使載入頁面時間較長，為方便使用者瀏覽，此處(本頁、XML、JSON、TTL)僅擷取部分代碼，完整代碼可至[全國專門術語服務平臺－值集(Value Set)](https://fhir.mohw.gov.tw/ts/valueset.jsp)查閱","StructureDefinition/PACCondition","tw.gov.mohw.twcore"
https://twcore.mohw.gov.tw/ig/twcore/ValueSet/icd-10-cm-2021-tw,2022-07-29,active,,TW2021ICD10CM,臺灣健保署2021年中文版ICD-10-CM值集,"臺灣健保署2021年中文版ICD-10-CM值集。 資料所屬單位：衛生福利部中央健康保險署。  此值集所涵蓋代碼量較大會使載入頁面時間較長，為方便使用者瀏覽，此處(本頁、XML、JSON、TTL)僅擷取部分代碼，完整代碼可至[全國專門術語服務平臺－值集(Value Set)](https://fhir.mohw.gov.tw/ts/valueset.jsp)查閱","StructureDefinition/PACCondition","tw.gov.mohw.twcore"
https://twcore.mohw.gov.tw/ig/twcore/ValueSet/icd-10-cm-2023-tw,2024-11-18,active,,TW2023ICD10CM,臺灣健保署2023年中文版ICD-10-CM值集,"臺灣健保署2023年中文版ICD-10-CM值集。 資料所屬單位：衛生福利部中央健康保險署。  此值集所涵蓋代碼量較大會使載入頁面時間較長，為方便使用者瀏覽，此處(本頁、XML、JSON、TTL)僅擷取部分代碼，完整代碼可至[全國專門術語服務平臺－值集(Value Set)](https://fhir.mohw.gov.tw/ts/valueset.jsp)查閱","StructureDefinition/PACCondition","tw.gov.mohw.twcore"
https://twcore.mohw.gov.tw/ig/twcore/ValueSet/icd-10-pcs-2014-tw,2017-07-19,active,,TW2014ICD10PCS,臺灣健保署2014年中文版ICD-10-PCS值集,"臺灣健保署2014年中文版ICD-10-PCS值集。 資料所屬單位：衛生福利部中央健康保險署。  此值集所涵蓋代碼量較大會使載入頁面時間較長，為方便使用者瀏覽，此處(本頁、XML、JSON、TTL)僅擷取部分代碼，完整代碼可至[全國專門術語服務平臺－值集(Value Set)](https://fhir.mohw.gov.tw/ts/valueset.jsp)查閱","StructureDefinition/Procedure","tw.gov.mohw.twcore"
https://twcore.mohw.gov.tw/ig/twcore/ValueSet/icd-10-pcs-2021-tw,2022-07-29,active,,TW2021ICD10PCS,臺灣健保署2021年中文版ICD-10-PCS值集,"臺灣健保署2021年中文版ICD-10-PCS值集。 資料所屬單位：衛生福利部中央健康保險署。  此值集所涵蓋代碼量較大會使載入頁面時間較長，為方便使用者瀏覽，此處(本頁、XML、JSON、TTL)僅擷取部分代碼，完整代碼可至[全國專門術語服務平臺－值集(Value Set)](https://fhir.mohw.gov.tw/ts/valueset.jsp)查閱","StructureDefinition/Procedure","tw.gov.mohw.twcore"
https://twcore.mohw.gov.tw/ig/twcore/ValueSet/icd-10-pcs-2023-tw,2024-11-18,active,,TW2023ICD10PCS,臺灣健保署2023年中文版ICD-10-PCS值集,"臺灣健保署2023年中文版ICD-10-PCS值集。 資料所屬單位：衛生福利部中央健康保險署。  此值集所涵蓋代碼量較大會使載入頁面時間較長，為方便使用者瀏覽，此處(本頁、XML、JSON、TTL)僅擷取部分代碼，完整代碼可至[全國專門術語服務平臺－值集(Value Set)](https://fhir.mohw.gov.tw/ts/valueset.jsp)查閱","StructureDefinition/Procedure","tw.gov.mohw.twcore"
https://twcore.mohw.gov.tw/ig/twcore/ValueSet/icd-9-cm-2001-tw,2023-05-09,active,,TW2001ICD9CM,臺灣健保署2001年中文版ICD-9-CM值集,"臺灣健保署2001年中文版ICD-9-CM值集。 資料所屬單位：衛生福利部中央健康保險署。   此值集所涵蓋代碼量較大會使載入頁面時間較長，為方便使用者瀏覽，此處(本頁、XML、JSON、TTL)僅擷取部分代碼，完整代碼可至[全國專門術語服務平臺－臺灣健保署2001年中文版ICD-9-CM值集](https://fhir.mohw.gov.tw/ts/valuesetRead.jsp?id=icd-9-cm-2001-tw&status=active&version=2023-05-09&metaId=1&composeId=0&composeSystem=0&composeVersion=0&pageSet=preview)查閱","StructureDefinition/PACCondition","tw.gov.mohw.twcore"
https://twcore.mohw.gov.tw/ig/twcore/ValueSet/identifier-type-tw,0.3.0,active,,TWIdentifierType,IdentifierType + 臺灣衛福部資訊處識別碼類型值集,"IdentifierType + 臺灣衛福部資訊處識別碼類型值集","StructureDefinition/Patient,StructureDefinition/Practitioner,StructureDefinition/Organization","THO (V2),tw.gov.mohw.twcore"
https://twcore.mohw.gov.tw/ig/twcore/ValueSet/loinc-survey-codes,2.77,active,,LOINCSurveyCode,LOINC篩檢與評估值集,"LOINC篩檢與評估值集。 代碼版本：2.77；代碼更新日期：2024-06-14；資料所屬單位：Regenstrief Institute。","StructureDefinition/ObservationScreeningAssessment","LOINC"
https://twcore.mohw.gov.tw/ig/twcore/ValueSet/medical-consultation-department-tw,0.3.0,active,,TWMedicalConsultationDepartment,無法對應至SNOMED CT之臺灣健保署就醫科別值集,"無法對應至SNOMED CT之臺灣健保署就醫科別值集。  此值集優先採用國際標準碼，國際標準碼未能表述之概念則以普遍被使用的臺灣健保署標準碼表述，請實作者留意。 ","StructureDefinition/Encounter,StructureDefinition/PractitionerRole","tw.gov.mohw.twcore"
https://twcore.mohw.gov.tw/ig/twcore/ValueSet/medical-department-sct-tw,0.3.0,active,,TWMedicalDepartmentSCT,對應至 SNOMED CT之就醫科別 + 診療科別值集,"因就醫科別與診療科別對應到之國際標準碼 SNOMED CT有共通代碼，因此本值集將兩者的對應代碼整合於同一值集中。    另為便於使用者更清晰地辨識「[就醫科別](ValueSet-medical-department-sct-tw.html#就醫科別對應表)」及「[診療科別](ValueSet-medical-department-sct-tw.html#診療科別對應表)」的各別完整值集範圍，請參閱以下兩個表格，代碼使用原則為：若想表達的語意有國際代碼可表述，便採用國際代碼；若無對應的國際代碼可表述，則採用健保署編訂的代碼。  ","StructureDefinition/Encounter,StructureDefinition/PractitionerRole","SCT"
https://twcore.mohw.gov.tw/ig/twcore/ValueSet/medical-treatment-department-tw,0.3.0,active,,TWMedicalTreatmentDepartment,無法對應至SNOMED CT之臺灣健保署診療科別值集,"無法對應至SNOMED CT之臺灣健保署診療科別值集。  此值集優先採用國際標準碼，國際標準碼未能表述之概念則以普遍被使用的臺灣健保署標準碼表述，請實作者留意。 ","StructureDefinition/Encounter,StructureDefinition/PractitionerRole","tw.gov.mohw.twcore"
https://twcore.mohw.gov.tw/ig/twcore/ValueSet/narrative-status,0.3.0,active,,TWNarrativeStatus,臺灣衛福部資訊處Narrative狀態值集,"臺灣衛福部資訊處Narrative狀態值集","StructureDefinition/CarePlan,StructureDefinition/PACCarePlan","hl7.fhir.r4.core"
https://twcore.mohw.gov.tw/ig/twcore/ValueSet/observation-screening-assessment-category,0.3.0,active,,TWObservationScreeningAssessmentCategory,臺灣衛福部資訊處Observation Screening Assessment類型值集,"臺灣衛福部資訊處Observation Screening Assessment類型值集","StructureDefinition/ObservationScreeningAssessment","tw.gov.mohw.twcore"
https://twcore.mohw.gov.tw/ig/twcore/ValueSet/procedure-tw,2024-05-27,active,,TWMedicalServicePayment,臺灣健保署醫療服務給付項目-處置或手術值集,"臺灣健保署醫療服務給付項目-處置或手術值集。 資料所屬單位：衛生福利部中央健康保險署。 ","StructureDefinition/Procedure","tw.gov.mohw.twcore"
